{
  "version": 1,
  "record": "docs/adr/0035-cuda-compile-flag-policy.md",
  "scope": {
    "records": [
      "the nvcc numeric flags every RayD CUDA translation unit is compiled with",
      "the virtual architecture of every ray-tracing PTX module",
      "which shared device-math headers are compiled under more than one numeric profile",
      "which of those divergences are frozen by decision rather than accidental"
    ],
    "excludes": [
      "epsilon and sentinel constants, which include/rayd/math.h owns",
      "host compiler flags, optimization level, and warning flags, which change no device arithmetic",
      "include directories, preprocessor definitions, -std, --extended-lambda, and -Xcompiler=-fPIC",
      "the effective command line after CMake resolves build-type and CUDA-language defaults; this contract records flags as written in CMake"
    ]
  },
  "profiles": {
    "nvcc_default": {
      "flags": [],
      "semantics": [
        "ftz=false",
        "prec-div=true",
        "prec-sqrt=true",
        "fmad=true",
        "IEEE division and square root, correctly rounded"
      ],
      "note": "nvcc target defaults. The absence of a flag is the policy, so a translation unit silently inherits any flag later added target-wide."
    },
    "fast_math": {
      "flags": [
        "--use_fast_math"
      ],
      "semantics": [
        "ftz=true",
        "prec-div=false",
        "prec-sqrt=false",
        "fmad=true",
        "approximate transcendentals and reciprocals",
        "denormal inputs and results flushed to zero"
      ],
      "note": "Changes the value of division, square root, reciprocal, and every transcendental in the whole translation unit, including shared headers it pulls in."
    },
    "no_fmad": {
      "flags": [
        "--fmad=false"
      ],
      "semantics": [
        "ftz=false",
        "prec-div=true",
        "prec-sqrt=true",
        "fmad=false",
        "no multiply-add contraction, so a*b+c rounds twice"
      ],
      "note": "ADR-0026 imported this from Channel to keep lockstep and AD translation units bitwise reproducible against their former owner."
    },
    "precise_no_ftz": {
      "flags": [
        "--ftz=false",
        "--prec-div=true",
        "--prec-sqrt=true"
      ],
      "semantics": [
        "ftz=false",
        "prec-div=true",
        "prec-sqrt=true",
        "fmad=true",
        "identical arithmetic to nvcc_default"
      ],
      "note": "These three flags equal nvcc's own defaults. ADR-0033 spells them out so the penetration family cannot inherit a fast-math option added elsewhere; they exist to defend the family, not to change its arithmetic."
    }
  },
  "translation_units": [
    {
      "backend": "drjit",
      "unit": "edge_bvh",
      "source": "src/edge/edge_bvh_jit.cu",
      "kind": "object",
      "target": "rayd_core",
      "profile": "nvcc_default",
      "default_enabled": true
    },
    {
      "backend": "drjit",
      "unit": "shared_bvh_core_build",
      "source": "src/bvh_build_shared.cu",
      "kind": "object",
      "target": "rayd_core",
      "profile": "nvcc_default",
      "default_enabled": true
    },
    {
      "backend": "drjit",
      "unit": "shared_bvh_build",
      "source": "src/edge/edge_shared.cu",
      "kind": "object",
      "target": "rayd_core",
      "profile": "nvcc_default",
      "default_enabled": true
    },
    {
      "backend": "drjit",
      "unit": "shared_bvh_query",
      "source": "src/edge/edge_shared.cu",
      "kind": "object",
      "target": "rayd_core",
      "profile": "nvcc_default",
      "default_enabled": true
    },
    {
      "backend": "drjit",
      "unit": "shared_edge_distance",
      "source": "src/edge/edge_shared.cu",
      "kind": "object",
      "target": "rayd_core",
      "profile": "nvcc_default",
      "default_enabled": true
    },
    {
      "backend": "drjit",
      "unit": "shared_edge_aabb",
      "source": "src/edge/edge_shared.cu",
      "kind": "object",
      "target": "rayd_core",
      "profile": "nvcc_default",
      "default_enabled": true
    },
    {
      "backend": "drjit",
      "unit": "shared_bvh_triangle_query",
      "source": "src/bvh_triangle_query_shared.cu",
      "kind": "object",
      "target": "rayd_core",
      "profile": "nvcc_default",
      "default_enabled": true
    },
    {
      "backend": "drjit",
      "unit": "triangle_bvh",
      "source": "src/scene/triangle_bvh_jit.cu",
      "kind": "object",
      "target": "rayd_core",
      "profile": "nvcc_default",
      "default_enabled": true
    },
    {
      "backend": "drjit",
      "unit": "cuda_multipath",
      "source": "src/scene/multipath_jit.cu",
      "kind": "object",
      "target": "rayd_core",
      "profile": "fast_math",
      "default_enabled": true
    },
    {
      "backend": "drjit",
      "unit": "reflection_dedup",
      "source": "src/reflection/reflection_kernels_jit.cu",
      "kind": "object",
      "target": "rayd_core",
      "profile": "nvcc_default",
      "default_enabled": true
    },
    {
      "backend": "drjit",
      "unit": "shared_reflection_dedup",
      "source": "src/reflection/dedup_shared.cu",
      "kind": "object",
      "target": "rayd_core",
      "profile": "nvcc_default",
      "default_enabled": true
    },
    {
      "backend": "drjit",
      "unit": "reflection_epc_field",
      "source": "src/reflection/reflection_kernels_jit.cu",
      "kind": "object",
      "target": "rayd_core",
      "profile": "nvcc_default",
      "default_enabled": true
    },
    {
      "backend": "drjit",
      "unit": "diffraction_accumulation_ad",
      "source": "src/diffraction/diffraction_ad_jit.cu",
      "kind": "object",
      "target": "rayd_core",
      "profile": "nvcc_default",
      "default_enabled": true
    },
    {
      "backend": "drjit",
      "unit": "reflection_trace",
      "source": "src/reflection/trace_optix_jit.cu",
      "kind": "ptx",
      "target": "rayd_core",
      "profile": "fast_math",
      "default_enabled": false,
      "arch": "compute_70",
      "option": "RAYD_REGENERATE_REFLECTION_TRACE_PTX"
    },
    {
      "backend": "drjit",
      "unit": "reflection_epc",
      "source": "src/reflection/epc_optix_jit.cu",
      "kind": "ptx",
      "target": "rayd_core",
      "profile": "fast_math",
      "default_enabled": false,
      "arch": "compute_70",
      "option": "RAYD_REGENERATE_REFLECTION_EPC_PTX"
    },
    {
      "backend": "drjit",
      "unit": "reflection_accumulation",
      "source": "src/reflection/accumulation_optix_jit.cu",
      "kind": "ptx",
      "target": "rayd_core",
      "profile": "fast_math",
      "default_enabled": false,
      "arch": "compute_70",
      "option": "RAYD_REGENERATE_REFLECTION_ACCUMULATION_PTX"
    },
    {
      "backend": "drjit",
      "unit": "diffraction_accumulation",
      "source": "src/diffraction/accumulation_optix_jit.cu",
      "kind": "ptx",
      "target": "rayd_core",
      "profile": "fast_math",
      "default_enabled": false,
      "arch": "compute_70",
      "option": "RAYD_REGENERATE_DIFFRACTION_ACCUMULATION_PTX"
    },
    {
      "backend": "drjit",
      "unit": "diffraction_paths",
      "source": "src/diffraction/paths_optix_jit.cu",
      "kind": "ptx",
      "target": "rayd_core",
      "profile": "fast_math",
      "default_enabled": false,
      "arch": "compute_70",
      "option": "RAYD_REGENERATE_DIFFRACTION_PATHS_PTX"
    },
    {
      "backend": "drjit",
      "unit": "segment_visibility",
      "source": "src/visibility/visibility_optix_jit.cu",
      "kind": "ptx",
      "target": "rayd_core",
      "profile": "fast_math",
      "default_enabled": false,
      "arch": "compute_70",
      "option": "RAYD_REGENERATE_SEGMENT_VISIBILITY_PTX"
    },
    {
      "backend": "drjit",
      "unit": "surfel_trace",
      "source": "src/surfel_optix_jit.cu",
      "kind": "ptx",
      "target": "rayd_core",
      "profile": "fast_math",
      "default_enabled": false,
      "arch": "compute_70",
      "option": "RAYD_REGENERATE_SURFEL_TRACE_PTX"
    },
    {
      "backend": "drjit",
      "unit": "edge_optix",
      "source": "src/edge/edge_optix_jit.cu",
      "kind": "ptx",
      "target": "rayd_core",
      "profile": "fast_math",
      "default_enabled": false,
      "arch": "compute_70",
      "option": "RAYD_REGENERATE_EDGE_OPTIX_PTX"
    },
    {
      "backend": "torch",
      "unit": "rayd_torch_optix_ptx",
      "source": "src/scene/intersection_optix.cu",
      "kind": "ptx",
      "target": "rayd_torch_native_core",
      "profile": "fast_math",
      "default_enabled": true,
      "arch": "compute_75"
    },
    {
      "backend": "torch",
      "unit": "rayd_torch_edge_optix_point_ray_ptx",
      "source": "src/edge/edge_optix.cu",
      "kind": "ptx",
      "target": "rayd_torch_native_core",
      "profile": "fast_math",
      "default_enabled": true,
      "arch": "compute_75"
    },
    {
      "backend": "torch",
      "unit": "rayd_torch_edge_optix_topk_ptx",
      "source": "src/edge/edge_optix.cu",
      "kind": "ptx",
      "target": "rayd_torch_native_core",
      "profile": "fast_math",
      "default_enabled": true,
      "arch": "compute_75"
    },
    {
      "backend": "torch",
      "unit": "rayd_torch_reflection_trace_ptx",
      "source": "src/reflection/trace_optix.cu",
      "kind": "ptx",
      "target": "rayd_torch_native_core",
      "profile": "fast_math",
      "default_enabled": true,
      "arch": "compute_75"
    },
    {
      "backend": "torch",
      "unit": "rayd_torch_segment_visibility_ptx",
      "source": "src/visibility/visibility_optix.cu",
      "kind": "ptx",
      "target": "rayd_torch_native_core",
      "profile": "fast_math",
      "default_enabled": true,
      "arch": "compute_75"
    },
    {
      "backend": "torch",
      "unit": "rayd_torch_axial_edge_visibility_ptx",
      "source": "src/visibility/axial_edge_visibility_optix.cu",